//1. Creation and Alteration of tables

create table client_master46(client_no varchar(6) CHECK (client_no like 'c%') primary key,name varchar(30) not null,address1 varchar(100),address2 varchar(100),city varchar(10),pincode int,state varchar(20),bal_due int);

create table product_master46(product_no varchar2(10) primary key check(product_no like 'p%'),description varchar(15) not null,profit_percent number(2,0),unit_measure varchar(10),qty_on_hand number(3,0),recoder_lvl number(2,0),sell_price number(5,0),cost_price number(5,0));

create table sales_master_46(Salesman_no varchar(6) CHECK (Salesman_no like 's%') primary key,Salesman_name varchar(30) not null,address varchar(10),City varchar(20),Pincode int,State varchar(30),Sal_amt int CHECK (Sal_amt!=0),Tgt_to_get int CHECK (Tgt_to_get!=0),Ttd_sales int,Remarsks varchar(30));

create table sales_order46(order_no varchar2(10) primary key check(order_no like 'o%'),order_date date,client_no  varchar2(10),dely_addr varchar2(20),salesman_no varchar2(10),dely_type varchar2(10) default 'F',billed_yn varchar2(10),dely_date date,order_status varchar2(10) check(order_status in('in process','fulfilled','backorder','cancelled')),foreign key(client_no) references client_master46(client_no),foreign key(salesman_no) references sales_master_46(salesman_no));

create table Sales_order_details46(Order_no varchar(6), Product_no varchar(6),Qty_ordered int,Qty_number int,Product_rate int,FOREIGN KEY (Order_no) REFERENCES sales_order46(Order_no),FOREIGN KEY (Product_no) REFERENCES product_master46(Product_no));

Alter table client_master46 rename TO clientmaster_46;

Alter table sales_order46 add check(dely_date > order_date);

Alter table product_master46 add check(cost_price>0);

Alter table product_master46 modify cost_price number(10,2) not null;

Alter table product_master46 add check(sell_price>0);

//2. Insertion of values into the tables

insert into clientmaster_46 values('c00001','Ivan bayross','Wandon','Worli','Mumbai',450005,'Maharashtra',15000);

insert into clientmaster_46 values('c00002','Vandana saitwa','Don Street','Bandra','Madras',780001,'TamilNadu',0);

insert into clientmaster_46 values('c00003','Pramadajagust','Mandon','Dabar','Mumbai',450007,'Maharashtra',5000);

insert into clientmaster_46 values('c00004','Basu navindgi','Jerome','juhu','Mumbai',450009,'Maharashtra',0);

insert into clientmaster_46 values('c00005','Ravisreedharan','Dadar','Dadra','Delhi',100003,'Delhi',2000);

insert into clientmaster_46 values('c00006','Rukmini','Rourk','Bandra','Mumbai',4500002,'Maharashtra',0);

insert into product_master46 values('p00001','1.44 flopies',5,'piece',100,20,525,500);

insert into product_master46 values('p03453','Monitors',6,'piece',10,3,12000,11280);

insert into product_master46 values('p45789','Mouse',5,'piece',20,5,1050,1000);

insert into product_master46 values('p44683','Keyboards',5,'piece',100,20,3150,3050);

insert into product_master46 values('p45123','CD Drive',2,'piece',10,3,5250,5100);

insert into product_master46 values('p35412','540 HDD',2.5,'piece',10,3,8400,8000);

insert into sales_master_46 values('s00001','Kiran','1/14','Worli',450001,'Bombay',3000,100,50,'Good');

insert into sales_master_46 values('s00002','Maneesh','j-65','Nariman',450001,'Bombay',3000,200,100,'Good');

insert into sales_master_46 values('s00003','Ravi','p-7','Bandra',450003,'Bombay',3000,200,100,'Good');

insert into sales_master_46 values('s00004','Ashish','a/5','Juhu',400041,'Bombay',3000,200,150,'Good');

insert into sales_order46 values('o19001','12-jan-96','c00001','Wandon','s00001','F','N','20-jan-96','in process');

insert into sales_order46 values('o19002','25-jan-96','c00002','Don street','s00002','P','N','27-jan-96','cancelled');

insert into sales_order46 values('o46865','18-feb-96','c00003','Mandon','s00003','F','Y','20-feb-96','fulfilled');

insert into sales_order46 values('o19003','03-apr-96','c00001','Jerome','s00001','F','Y','07-apr-96','fulfilled');

insert into sales_order46 values('o46866','20-may-96','c00004','Dadar','s00002','P','N','22-may-96','cancelled');

insert into sales_order46 values('o19008','24-may-96','c00005','Rourk','s00004','F','N','26-may-96','in process');

insert into Sales_order_details46 values('o19001','p00001',4,4,525);

insert into Sales_order_details46 values('o19002','p00001',10,0,525);

insert into Sales_order_details46 values('o46865','p00001',10,10,525);

insert into Sales_order_details46 values('o46865','p03453',4,4,1050);

insert into Sales_order_details46 values('o19003','p03453',2,2,1050);

insert into Sales_order_details46 values('o19008','p00001',10,5,525);

//3. Computation of table data

select Salesman_name from sales_master_46 where Salesman_name like '_a%';


SALESMAN_NAME
------------------------------
Maneesh
Ravi


 
select name from clientmaster_46 where name like 'R%' and city like '%Delhi%';


NAME
------------------------------
Ravisreedharan


select name,address1 from clientmaster_46 where city='Maharashtra' or city='Delhi';  --


NAME			       ADDRESS1
------------------------------ ----------------------------------------------------------------------------------------------------
Ravisreedharan		       Dadar

 
select * from product_master46 where Cost_price>5000;


PRODUCT_NO DESCRIPTION	   PROFIT_PERCENT UNIT_MEASU QTY_ON_HAND RECODER_LVL SELL_PRICE COST_PRICE
---------- --------------- -------------- ---------- ----------- ----------- ---------- ----------
p03453	   Monitors			6 piece 	      10	   3	  12000      11280
p45123	   CD Drive			2 piece 	      10	   3	   5250       5100
p35412	   540 HDD			3 piece 	      10	   3	   8400       8000


 
select * from sales_order46 where Order_date like '%MAY%';


ORDER_NO   ORDER_DAT CLIENT_NO	DELY_ADDR	     SALESMAN_N DELY_TYPE  BILLED_YN  DELY_DATE ORDER_STAT
---------- --------- ---------- -------------------- ---------- ---------- ---------- --------- ----------
o46866	   20-MAY-96 c00004	Dadar		     s00002	P	   N	      22-MAY-96 cancelled
o19008	   24-MAY-96 c00005	Rourk		     s00004	F	   N	      26-MAY-96 in process


 
select * from sales_master_46 where Salesman_no in('s00001','s00002');


SALESM SALESMAN_NAME		      ADDRESS	 CITY			 PINCODE STATE				   SAL_AMT TGT_TO_GET  TTD_SALES REMARSKS
------ ------------------------------ ---------- -------------------- ---------- ------------------------------ ---------- ---------- ---------- ------------------------------
s00001 Kiran			      1/14	 Worli			  450001 Bombay 			      3000	  100	      50 Good
s00002 Maneesh			      j-65	 Nariman		  450001 Bombay 			      3000	  200	     100 Good



select * from product_master46 where Sell_price<2000 and  Sell_price<=5000;


PRODUCT_NO DESCRIPTION	   PROFIT_PERCENT UNIT_MEASU QTY_ON_HAND RECODER_LVL SELL_PRICE COST_PRICE
---------- --------------- -------------- ---------- ----------- ----------- ---------- ----------
p00001	   1.44 flopies 		5 piece 	     100	  20	    525        500
p45789	   Mouse			5 piece 	      20	   5	   1050       1000



select Product_no,Sell_price,sell_price+((20*Sell_price)/100) new_selling_price from product_master46 where Sell_price>3000;


PRODUCT_NO SELL_PRICE NEW_SELLING_PRICE
---------- ---------- -----------------
p03453		12000		  14400
p44783		 3150		   3780
p45123		 5250		   6300
p35412		 8400		  10080


select count(*) from product_master46;


  COUNT(*)
----------
	 6


 
select count(*) from sales_order46 where Order_status='fulfilled';


  COUNT(*)
----------
	 2


 
select avg(Cost_price) from product_master46;


AVG(COST_PRICE)
---------------
     4821.66667




//4. Date manipulation

select order_no, TO_CHAR(order_date,'day') as day from sales_order46; --


ORDER_NO   DAY
---------- ---------
o19001	   friday
o19002	   thursday
o46865	   sunday
o19003	   wednesday
o46866	   monday
o19008	   friday


 
select order_no,TO_CHAR(dely_date,'day') as day ,TO_CHAR(dely_date,'month') as month from sales_order46; --


ORDER_NO   DAY	     MONTH
---------- --------- ---------
o19001	   saturday  january
o19002	   saturday  january
o46865	   tuesday   february
o19003	   sunday    april
o46866	   wednesday may
o19008	   sunday    may



select TO_CHAR(order_date,'DD/MONTH/YYYY') as Dat from sales_order46; --


Dat
-----------------
12/JANUARY  /1996
25/JANUARY  /1996
18/FEBRUARY /1996
03/APRIL    /1996
20/MAY	    /1996
24/MAY	    /1996


 
select sysdate+15 from dual;
 

SYSDATE+1
---------
30-OCT-18



select dely_date-order_date as totaldays from sales_order46; --


 TOTALDAYS
----------
	 8
	 2
	 2
	 4
	 2
	 2



*******************************************************************************
New Table for the next question
*******************************************************************************
create table item_order46(name varchar(10),address varchar(10),item varchar(10),price int);

insert into item_order46 values('Basu','Worli','Monitor',100);

insert into item_order46 values('Ivan','Juhu','Keyboard',800);

insert into item_order46 values('Ivan','Worli','Printer',1500);

insert into item_order46 values('Bayross','Wandon','Printer',1500);

insert into item_order46 values('Basu','Dadar','Mouse',500);

insert into item_order46 values('Vandana','Wandon','Monitor',1000);

insert into item_order46 values('Vandana','Wandon','Keyboard',800);

insert into item_order46 values('Bayross','Juhu','Mouse',500);


*******************************************************************************
End
*******************************************************************************

//5. Having and Group by clauses

select item,sum(price) from item_order46 group by item;


ITEM	   SUM(PRICE)
---------- ----------
Printer 	 3000
Mouse		 1000
Keyboard	 1600
Monitor 	 1100



select name,item from item_order46 group by (name,item); --change


NAME	   ITEM
---------- ----------
Basu	   Mouse
Vandana    Monitor
Bayross    Printer
Basu	   Monitor
Ivan	   Printer
Vandana    Keyboard
Bayross    Mouse
Ivan	   Keyboard



select item,address  from item_order46 group by (item,address); --change


ITEM	   ADDRESS
---------- ----------
Keyboard   Juhu
Printer    Worli
Keyboard   Wandon
Mouse	   Dadar
Mouse	   Juhu
Monitor    Worli
Monitor    Wandon
Printer    Wandon



select name,price from item_order46 having price>200 group by(name,price);


NAME		PRICE
---------- ----------
Ivan		  800
Vandana 	  800
Vandana 	 1000
Bayross 	 1500
Basu		  500
Ivan		 1500
Bayross 	  500



//6. Subqueries

select name,address1,address2,city,pincode from clientmaster_46 where client_no=(select client_no from sales_order46 where order_no='o19001');


NAME			       ADDRESS1
------------------------------ ----------------------------------------------------------------------------------------------------
ADDRESS2											     CITY	   PINCODE
---------------------------------------------------------------------------------------------------- ---------- ----------
Ivan bayross		       Wandon
Worli												     Mumbai	    450005



select name from clientmaster_46 where client_no in(select client_no from sales_order46 where order_date<='01-may-1996');


NAME
------------------------------
Ivan bayross
Vandana saitwa
Pramadajagust



select client_no,name from clientmaster_46 where client_no in(select client_no from sales_order46 where order_no in(select order_no from sales_order_details46 where product_no=(select product_no from product_master46 where description='1.44 flopies')));


CLIENT NAME
------ ------------------------------
c00001 Ivan bayross
c00002 Vandana saitwa
c00003 Pramadajagust
c00005 Ravisreedharan



select product_no,description from product_master46 where product_no not in(select product_no from sales_order_details46);


PRODUCT_NO DESCRIPTION
---------- ---------------
p35412	   540 HDD
p44783	   Keyboards
p45123	   CD Drive
p45789	   Mouse



select name from clientmaster_46 where client_no in(select client_no from sales_order46 where order_no in(select order_no from sales_order_details46 where qty_ordered*product_rate>=10000));


no rows selected


//7. View

create view client46 as select client_no,name,city from clientmaster_46;

CLIENT NAME			      CITY
------ ------------------------------ ----------
c00001 Ivan bayross		      Mumbai
c00002 Vandana saitwa		      Madras
c00003 Pramadajagust		      Mumbai
c00004 Basu navindgi		      Mumbai
c00005 Ravisreedharan		      Delhi
c00006 Rukmini			      Mumbai


update client46 set city='NaviMumbai' where city='Mumbai';

select * from client46;

CLIENT NAME			      CITY
------ ------------------------------ ----------
c00001 Ivan bayross		      NaviMumbai
c00002 Vandana saitwa		      Madras
c00003 Pramadajagust		      NaviMumbai
c00004 Basu navindgi		      NaviMumbai
c00005 Ravisreedharan		      Delhi
c00006 Rukmini			      NaviMumbai
